{
  "v": 1,
  "case_id": "3066d18d-62c0-42e7-8a82-0842069667f4",
  "case_type": "criminal",
  "stance": null,
  "parties": [
    {
      "id": "F0001",
      "text": "周某甲，犯罪嫌疑人，被指控诈骗陈某乙18万元",
      "citations": [],
      "status": "unconfirmed"
    },
    {
      "id": "F0002",
      "text": "陈某乙，被害人，报案指控被周某甲诈骗18万元",
      "citations": [],
      "status": "unconfirmed"
    },
    {
      "id": "F0003",
      "text": "赵某丙，证人，介绍陈某乙与周某甲认识",
      "citations": [
        "〔陈某乙询问笔录（第一次） 第7行〕"
      ],
      "status": "excerpt"
    },
    {
      "id": "F0004",
      "text": "孙某丁，证人，虚构市某某农业科技有限公司会计",
      "citations": [
        "〔孙某丁询问笔录 第3行〕"
      ],
      "status": "excerpt"
    },
    {
      "id": "F0005",
      "text": "周某己，案外人，周某甲妻子，公司法定代表人",
      "citations": [
        "〔周某甲讯问笔录（第一次） 第17行〕"
      ],
      "status": "excerpt"
    },
    {
      "id": "F0006",
      "text": "刘某戊，案外人，周某甲账户转账对象",
      "citations": [
        "〔银行交易明细（周某甲账户） 第10行〕"
      ],
      "status": "excerpt"
    },
    {
      "id": "F0007",
      "text": "虚构市某某农业科技有限公司，周某甲实际负责的公司",
      "citations": [
        "〔周某甲讯问笔录（第一次） 第3行〕"
      ],
      "status": "excerpt"
    }
  ],
  "issues": [
    {
      "id": "F0008",
      "text": "款项性质：周某甲称借款，陈某乙称入股，孙某丁称投资款",
      "citations": [
        "〔周某甲讯问笔录（第一次） 第7行〕",
        "〔陈某乙询问笔录（第一次） 第13行〕"
      ],
      "status": "unconfirmed"
    },
    {
      "id": "F0009",
      "text": "是否承诺保本：陈某乙称承诺保本和12%收益，周某甲称只说过前景好",
      "citations": [
        "〔陈某乙询问笔录（第一次） 第9行〕"
      ],
      "status": "unconfirmed"
    },
    {
      "id": "F0010",
      "text": "认识时间：周某甲称2025年2月份，陈某乙称2025年3月10日",
      "citations": [],
      "status": "unconfirmed"
    },
    {
      "id": "F0011",
      "text": "还款情况：周某甲称5月6日转5万是还款，陈某乙称不是还款",
      "citations": [
        "〔周某甲讯问笔录（第一次） 第15行〕"
      ],
      "status": "unconfirmed"
    },
    {
      "id": "F0012",
      "text": "项目真实性：周某甲称有项目，孙某丁称无相关支出和合同",
      "citations": [
        "〔周某甲讯问笔录（第一次） 第13行〕",
        "〔孙某丁询问笔录 第5行〕"
      ],
      "status": "unconfirmed"
    },
    {
      "id": "F0013",
      "text": "金额确认：银行明细中8■,000.00元及对方户名识别不清",
      "citations": [
        "〔银行交易明细（周某甲账户） 第8行〕"
      ],
      "status": "unconfirmed"
    }
  ],
  "key_facts": [
    {
      "id": "F0014",
      "text": "陈某乙报案称被周某甲以农业项目为由骗取十八万元",
      "citations": [
        "〔陈某乙询问笔录（第一次） 第5行〕"
      ],
      "status": "excerpt"
    },
    {
      "id": "F0015",
      "text": "银行流水显示2025年3月12日周某甲账户收入100,000.00元，对方陈某乙",
      "citations": [
        "〔银行交易明细（周某甲账户） 第6行〕"
      ],
      "status": "excerpt"
    },
    {
      "id": "F0016",
      "text": "银行流水显示2025年3月20日周某甲账户收入8■,000.00元，对方陈某■（识别不清）",
      "citations": [
        "〔银行交易明细（周某甲账户） 第8行〕"
      ],
      "status": "excerpt"
    },
    {
      "id": "F0017",
      "text": "银行流水显示2025年5月6日周某甲账户支出50,000.00元，对方陈■乙（识别不清）",
      "citations": [
        "〔银行交易明细（周某甲账户） 第13行〕"
      ],
      "status": "excerpt"
    },
    {
      "id": "F0018",
      "text": "银行流水显示2025-04-02周某甲账户支出60,000.00元给刘某戊",
      "citations": [
        "〔银行交易明细（周某甲账户） 第10行〕"
      ],
      "status": "excerpt"
    },
    {
      "id": "F0019",
      "text": "孙某丁称公司账上无租地、买大棚材料等支出，未见项目合同票据",
      "citations": [
        "〔孙某丁询问笔录 第5行〕"
      ],
      "status": "excerpt"
    },
    {
      "id": "F0020",
      "text": "孙某丁称公司从未收到或申请过补贴",
      "citations": [
        "〔孙某丁询问笔录 第9行〕"
      ],
      "status": "excerpt"
    },
    {
      "id": "F0021",
      "text": "陈某乙第一次称周某甲未还款，第二次承认收到50,000.00元但称非还款",
      "citations": [
        "〔陈某乙询问笔录（第二次） 第4行〕"
      ],
      "status": "excerpt"
    },
    {
      "id": "F0022",
      "text": "银行交易明细中2025-05-06有一笔交易整行识别不清",
      "citations": [
        "〔银行交易明细（周某甲账户） 第14行〕"
      ],
      "status": "excerpt"
    },
    {
      "id": "F0023",
      "text": "材料清单显示有1份PDF文件已加密，未读",
      "citations": [
        "〔未找到依据〕"
      ],
      "status": "unconfirmed"
    }
  ],
  "generated_by": "P-20261003224448-6b03",
  "generated_at": "2026-10-03T22:51:40+08:00",
  "materials_at_generation": [
    {
      "material_id": "M0001",
      "sha256": "6b17b02c10fc64f7dda92f8cadc35918036d06ff4c27a95a3106f852d9c5713e"
    },
    {
      "material_id": "M0002",
      "sha256": "714cd167ddd105e2eaf6353bf4784bf7493a43ca2f2292685ea8e934bfe6891b"
    },
    {
      "material_id": "M0003",
      "sha256": "dfe24da87bf173f54fcfe016a6e81e44872ad37ee9583617917c870ee332245e"
    },
    {
      "material_id": "M0004",
      "sha256": "340fce845fc9c3da31c0e5008cb77c7d33434a0a378b03b908b691e1ccb0310f"
    },
    {
      "material_id": "M0005",
      "sha256": "28fee8a561a068614a3b79cc4648639219b7cd005001bc211f108dadb4762cd6"
    }
  ]
}